{
  "version": "1",
  "project": {
    "root": "/absolute/path/to/project",
    "include": ["src/main/java", "."],
    "exclude": [".git", "target", "build", "generated", "tests"],
    "overview_file": "README.md",
    "test_framework": "infer"
  },
  "pipeline": {
    "output_dir": "./generated/default",
    "duckdb_path": "./generated/analitico/witup-llm.duckdb",
    "replication_root": "./resources/wit-replication-package/data/output",
    "baseline_file": "wit.json",
    "save_prompts": true,
    "max_methods": 0,
    "judge_model": "openai_judge",
    "llm_mode": "multiagent",
    "deep_validation_subset_size": 8
  },
  "models": {
    "openai_main": {
      "provider": "openai_compatible",
      "model": "gpt-5.4",
      "base_url": "https://api.openai.com/v1",
      "api_key_env": "OPENAI_API_KEY",
      "temperature": 0.0,
      "timeout_seconds": 180,
      "max_retries": 2,
      "reasoning_effort": "low",
      "prompt_cache_retention": "24h",
      "service_tier": "auto",
      "max_output_tokens": 0
    },
    "openai_judge": {
      "provider": "openai_compatible",
      "model": "gpt-5.4",
      "base_url": "https://api.openai.com/v1",
      "api_key_env": "OPENAI_API_KEY",
      "temperature": 0.0,
      "timeout_seconds": 180,
      "max_retries": 2,
      "reasoning_effort": "low",
      "prompt_cache_retention": "24h",
      "service_tier": "auto",
      "max_output_tokens": 0
    }
  },
  "metrics": [
    {
      "name": "unit-tests",
      "kind": "tests",
      "command": "./mvnw -q -DskipITs test && ./bin/witup extrair-surefire --report-dir target/surefire-reports",
      "weight": 1.0,
      "value_regex": "WITUP_METRIC=([0-9]+(?:\\\\.[0-9]+)?)",
      "scale": 100.0,
      "working_directory": ".",
      "expected_outputs": ["target/surefire-reports"],
      "description": "Executa os testes unitários após a geração"
    },
    {
      "name": "jacoco-line-coverage",
      "kind": "coverage",
      "command": "./mvnw -q org.jacoco:jacoco-maven-plugin:0.8.12:prepare-agent test org.jacoco:jacoco-maven-plugin:0.8.12:report && ./bin/witup extrair-jacoco --xml target/site/jacoco/jacoco.xml --counter LINE",
      "weight": 1.0,
      "value_regex": "WITUP_METRIC=([0-9]+(?:\\\\.[0-9]+)?)",
      "scale": 100.0,
      "working_directory": ".",
      "expected_outputs": ["target/site/jacoco/jacoco.xml"],
      "description": "Cobertura de linhas via JaCoCo (requer plugin no pom.xml do projeto-alvo)"
    },
    {
      "name": "jacoco-branch-coverage",
      "kind": "coverage",
      "command": "./mvnw -q org.jacoco:jacoco-maven-plugin:0.8.12:prepare-agent test org.jacoco:jacoco-maven-plugin:0.8.12:report && ./bin/witup extrair-jacoco --xml target/site/jacoco/jacoco.xml --counter BRANCH",
      "weight": 1.0,
      "value_regex": "WITUP_METRIC=([0-9]+(?:\\\\.[0-9]+)?)",
      "scale": 100.0,
      "working_directory": ".",
      "expected_outputs": ["target/site/jacoco/jacoco.xml"],
      "description": "Cobertura de branches via JaCoCo (extraída do mesmo relatório de linhas)"
    },
    {
      "name": "pit-mutation-score",
      "kind": "mutation",
      "command": "./mvnw -q -DtimestampedReports=false -DoutputFormats=XML org.pitest:pitest-maven:mutationCoverage && ./bin/witup extrair-pit --report-dir target/pit-reports",
      "weight": 1.0,
      "value_regex": "WITUP_METRIC=([0-9]+(?:\\\\.[0-9]+)?)",
      "scale": 100.0,
      "working_directory": ".",
      "expected_outputs": ["target/pit-reports/mutations.xml"],
      "description": "Mutation score via PIT (requer plugin pitest-maven no pom.xml do projeto-alvo)"
    }
  ]
}
